{
  "job_id": "job-2026-04-12-001",
  "plan_version": 1,
  "stages": [
    {
      "order": 1,
      "skill": "society-secretary-dues",
      "status": "pending",
      "goal": "2026 회비 입금 내역을 정규화하고 자동 반영 가능 거래와 예외 거래를 분리한다.",
      "input_sources": [
        "dues/2026/2026_bank_export_q1.xlsx",
        "members/2026/current_registry",
        "rules/2026_dues_policy.md"
      ],
      "outputs_expected": [
        "artifacts/dues_reconciled.xlsx",
        "artifacts/dues_summary.md",
        "review/review_items.md",
        "approval/approval_items.md"
      ],
      "stop_if": [
        "dues_rule_missing",
        "source_missing",
        "review_items_unresolved",
        "approval_required_before_membership_update"
      ],
      "handoff_to": "society-secretary-membership"
    },
    {
      "order": 2,
      "skill": "society-secretary-membership",
      "status": "pending",
      "goal": "확정된 회비 결과를 회원 명단 갱신안으로 변환한다.",
      "input_sources": [
        "artifacts/dues_reconciled.xlsx",
        "members/2026/current_registry"
      ],
      "outputs_expected": [
        "artifacts/membership_update_proposal.xlsx",
        "artifacts/membership_change_log.md"
      ],
      "stop_if": [
        "review_items_unresolved",
        "approval_required_before_registry_write"
      ],
      "handoff_to": null
    }
  ],
  "updated_at": "2026-04-12T01:45:00+09:00"
}
